
18:40:20.273565 IP 159.203.13.65.22 > 198.96.85.21.50272: Flags [P.], seq 9622216:9622372, ack 5113, win 313, length 156
18:40:20.273654 IP 159.203.13.65.22 > 198.96.85.21.50272: Flags [P.], seq 9622372:9622528, ack 5113, win 313, length 156
18:40:20.273692 IP 198.96.85.21.50272 > 159.203.13.65.22: Flags [.], ack 9617900, win 116, length 0
18:40:20.273811 IP 159.203.13.65.22 > 198.96.85.21.50272: Flags [P.], seq 9622528:9622788, ack 5113, win 313, length 260
18:40:20.273909 IP 159.203.13.65.22 > 198.96.85.21.50272: Flags [P.], seq 9622788:9622944, ack 5113, win 313, length 156
18:40:20.274009 IP 159.203.13.65.22 > 198.96.85.21.50272: Flags [P.], seq 9622944:9623100, ack 5113, win 313, length 156
18:40:20.274102 IP 159.203.13.65.22 > 198.96.85.21.50272: Flags [P.], seq 9623100:9623256, ack 5113, win 313, length 156
18:40:20.274207 IP 159.203.13.65.22 > 198.96.85.21.50272: Flags [P.], seq 9623256:9623412, ack 5113, win 313, length 156
18:40:20.274298 IP 159.203.13.65.22 > 198.96.85.21.50272: Flags [P.], seq 9623412:9623568, ack 5113, win 313, length 156
18:40:20.274431 IP 159.203.13.65.22 > 198.96.85.21.50272: Flags [P.], seq 9623568:9623724, ack 5113, win 313, length 156
18:40:20.274549 IP 159.203.13.65.22 > 198.96.85.21.50272: Flags [P.], seq 9623724:9623880, ack 5113, win 313, length 156
18:40:20.274669 IP 159.203.13.65.22 > 198.96.85.21.50272: Flags [P.], seq 9623880:9624036, ack 5113, win 313, length 156
18:40:20.274775 IP 159.203.13.65.22 > 198.96.85.21.50272: Flags [P.], seq 9624036:9624192, ack 5113, win 313, length 156
18:40:20.274876 IP 159.203.13.65.22 > 198.96.85.21.50272: Flags [P.], seq 9624192:9624348, ack 5113, win 313, length 156
18:40:20.274979 IP 159.203.13.65.22 > 198.96.85.21.50272: Flags [P.], seq 9624348:9624504, ack 5113, win 313, length 156
18:40:20.275083 IP 159.203.13.65.22 > 198.96.85.21.50272: Flags [P.], seq 9624504:9624660, ack 5113, win 313, length 156
18:40:20.275210 IP 159.203.13.65.22 > 198.96.85.21.50272: Flags [P.], seq 9624660:9624816, ack 5113, win 313, length 156
18:40:20.275318 IP 159.203.13.65.22 > 198.96.85.21.50272: Flags [P.], seq 9624816:9624972, ack 5113, win 313, length 156
18:40:20.275417 IP 159.203.13.65.22 > 198.96.85.21.50272: Flags [P.], seq 9624972:9625128, ack 5113, win 313, length 156
18:40:20.275512 IP 159.203.13.65.22 > 198.96.85.21.50272: Flags [P.], seq 9625128:9625284, ack 5113, win 313, length 156
18:40:20.278905 IP 198.96.85.21.50272 > 159.203.13.65.22: Flags [.], ack 9618524, win 113, options [nop,nop,sack 1 {9618680:9619772}], length 0
18:40:20.278998 IP 159.203.13.65.22 > 198.96.85.21.50272: Flags [P.], seq 9625284:9625440, ack 5113, win 313, length 156
18:40:20.279028 IP 198.96.85.21.50272 > 159.203.13.65.22: Flags [.], ack 9618524, win 113, options [nop,nop,sack 1 {9618680:9620032}], length 0
18:40:20.279046 IP 159.203.13.65.22 > 198.96.85.21.50272: Flags [P.], seq 9618524:9618680, ack 5113, win 313, length 156
18:40:20.279052 IP 198.96.85.21.50272 > 159.203.13.65.22: Flags [.], ack 9618524, win 113, options [nop,nop,sack 1 {9618680:9620500}], length 0
18:40:20.279065 IP 198.96.85.21.50272 > 159.203.13.65.22: Flags [.], ack 9618524, win 113, options [nop,nop,sack 1 {9618680:9620656}], length 0
18:40:20.279073 IP 198.96.85.21.50272 > 159.203.13.65.22: Flags [.], ack 9618524, win 113, options [nop,nop,sack 1 {9618680:9622372}], length 0
18:40:20.279468 IP 159.203.13.65.22 > 198.96.85.21.50272: Flags [P.], seq 9625440:9626444, ack 5113, win 313, length 1004
18:40:20.279583 IP 159.203.13.65.22 > 198.96.85.21.50272: Flags [P.], seq 9626444:9626608, ack 5113, win 313, length 164
18:40:20.279684 IP 159.203.13.65.22 > 198.96.85.21.50272: Flags [P.], seq 9626608:9626764, ack 5113, win 313, length 156
18:40:20.279783 IP 159.203.13.65.22 > 198.96.85.21.50272: Flags [P.], seq 9626764:9626920, ack 5113, win 313, length 156
18:40:20.279879 IP 159.203.13.65.22 > 198.96.85.21.50272: Flags [P.], seq 9626920:9627076, ack 5113, win 313, length 156
18:40:20.279988 IP 159.203.13.65.22 > 198.96.85.21.50272: Flags [P.], seq 9627076:9627232, ack 5113, win 313, length 156
18:40:20.280087 IP 159.203.13.65.22 > 198.96.85.21.50272: Flags [P.], seq 9627232:9627388, ack 5113, win 313, length 156
18:40:20.280190 IP 159.203.13.65.22 > 198.96.85.21.50272: Flags [P.], seq 9627388:9627544, ack 5113, win 313, length 156
18:40:20.280329 IP 159.203.13.65.22 > 198.96.85.21.50272: Flags [P.], seq 9627544:9627700, ack 5113, win 313, length 156
18:40:20.280447 IP 159.203.13.65.22 > 198.96.85.21.50272: Flags [P.], seq 9627700:9627856, ack 5113, win 313, length 156
18:40:20.280546 IP 159.203.13.65.22 > 198.96.85.21.50272: Flags [P.], seq 9627856:9628012, ack 5113, win 313, length 156
18:40:20.280619 IP 198.96.85.21.50272 > 159.203.13.65.22: Flags [.], ack 9618524, win 113, options [nop,nop,sack 1 {9618680:9622528}], length 0
18:40:20.280643 IP 198.96.85.21.50272 > 159.203.13.65.22: Flags [.], ack 9618524, win 113, options [nop,nop,sack 1 {9618680:9622788}], length 0
18:40:20.280651 IP 198.96.85.21.50272 > 159.203.13.65.22: Flags [.], ack 9618524, win 113, options [nop,nop,sack 1 {9618680:9625284}], length 0
18:40:20.280814 IP 159.203.13.65.22 > 198.96.85.21.50272: Flags [P.], seq 9628012:9628608, ack 5113, win 313, length 596
18:40:20.280928 IP 159.203.13.65.22 > 198.96.85.21.50272: Flags [P.], seq 9628608:9628764, ack 5113, win 313, length 156
18:40:20.281049 IP 159.203.13.65.22 > 198.96.85.21.50272: Flags [P.], seq 9628764:9628920, ack 5113, win 313, length 156
18:40:20.281157 IP 159.203.13.65.22 > 198.96.85.21.50272: Flags [P.], seq 9628920:9629076, ack 5113, win 313, length 156
18:40:20.281275 IP 159.203.13.65.22 > 198.96.85.21.50272: Flags [P.], seq 9629076:9629232, ack 5113, win 313, length 156
18:40:20.281399 IP 159.203.13.65.22 > 198.96.85.21.50272: Flags [P.], seq 9629232:9629388, ack 5113, win 313, length 156
18:40:20.281511 IP 159.203.13.65.22 > 198.96.85.21.50272: Flags [P.], seq 9629388:9629544, ack 5113, win 313, length 156
18:40:20.281619 IP 159.203.13.65.22 > 198.96.85.21.50272: Flags [P.], seq 9629544:9629700, ack 5113, win 313, length 156
18:40:20.281726 IP 159.203.13.65.22 > 198.96.85.21.50272: Flags [P.], seq 9629700:9629856, ack 5113, win 313, length 156
18:40:20.281838 IP 159.203.13.65.22 > 198.96.85.21.50272: Flags [P.], seq 9629856:9630012, ack 5113, win 313, length 156
18:40:20.281893 IP 198.96.85.21.50272 > 159.203.13.65.22: Flags [.], ack 9625440, win 86, length 0
18:40:20.281920 IP 198.96.85.21.50272 > 159.203.13.65.22: Flags [.], ack 9618524, win 113, options [nop,nop,sack 1 {9618680:9625440}], length 0
18:40:20.282039 IP 159.203.13.65.22 > 198.96.85.21.50272: Flags [P.], seq 9630012:9630416, ack 5113, win 313, length 404
18:40:20.282149 IP 159.203.13.65.22 > 198.96.85.21.50272: Flags [P.], seq 9630416:9630572, ack 5113, win 313, length 156
18:40:20.282250 IP 159.203.13.65.22 > 198.96.85.21.50272: Flags [P.], seq 9630572:9630728, ack 5113, win 313, length 156
18:40:20.282381 IP 159.203.13.65.22 > 198.96.85.21.50272: Flags [P.], seq 9630728:9630884, ack 5113, win 313, length 156
18:40:20.282481 IP 159.203.13.65.22 > 198.96.85.21.50272: Flags [P.], seq 9630884:9631040, ack 5113, win 313, length 156
18:40:20.282569 IP 159.203.13.65.22 > 198.96.85.21.50272: Flags [P.], seq 9631040:9631196, ack 5113, win 313, length 156
18:40:20.282657 IP 159.203.13.65.22 > 198.96.85.21.50272: Flags [P.], seq 9631196:9631352, ack 5113, win 313, length 156
18:40:20.282754 IP 159.203.13.65.22 > 198.96.85.21.50272: Flags [P.], seq 9631352:9631508, ack 5113, win 313, length 156
18:40:20.282843 IP 159.203.13.65.22 > 198.96.85.21.50272: Flags [P.], seq 9631508:9631664, ack 5113, win 313, length 156
18:40:20.282934 IP 159.203.13.65.22 > 198.96.85.21.50272: Flags [P.], seq 9631664:9631820, ack 5113, win 313, length 156
18:40:20.283027 IP 159.203.13.65.22 > 198.96.85.21.50272: Flags [P.], seq 9631820:9631976, ack 5113, win 313, length 156
18:40:20.283193 IP 198.96.85.21.50272 > 159.203.13.65.22: Flags [.], ack 9626920, win 81, length 0
18:40:20.283220 IP 159.203.13.65.22 > 198.96.85.21.50272: Flags [P.], seq 9631976:9632132, ack 5113, win 313, length 156
18:40:20.283377 IP 159.203.13.65.22 > 198.96.85.21.50272: Flags [P.], seq 9632132:9632392, ack 5113, win 313, length 260
18:40:20.283481 IP 159.203.13.65.22 > 198.96.85.21.50272: Flags [P.], seq 9632392:9632548, ack 5113, win 313, length 156
18:40:20.283565 IP 159.203.13.65.22 > 198.96.85.21.50272: Flags [P.], seq 9632548:9632704, ack 5113, win 313, length 156
18:40:20.287694 IP 198.96.85.21.50272 > 159.203.13.65.22: Flags [.], ack 9628012, win 76, length 0
18:40:20.287750 IP 159.203.13.65.22 > 198.96.85.21.50272: Flags [P.], seq 9632704:9632860, ack 5113, win 313, length 156
18:40:20.287777 IP 198.96.85.21.50272 > 159.203.13.65.22: Flags [.], ack 9631196, win 64, length 0
18:40:20.287798 IP 198.96.85.21.50272 > 159.203.13.65.22: Flags [.], ack 9632704, win 58, length 0
18:40:20.288055 IP 159.203.13.65.22 > 198.96.85.21.50272: Flags [P.], seq 9632860:9633320, ack 5113, win 313, length 460
18:40:20.288210 IP 159.203.13.65.22 > 198.96.85.21.50272: Flags [P.], seq 9633320:9633476, ack 5113, win 313, length 156
18:40:20.288393 IP 159.203.13.65.22 > 198.96.85.21.50272: Flags [P.], seq 9633476:9633632, ack 5113, win 313, length 156
18:40:20.288520 IP 159.203.13.65.22 > 198.96.85.21.50272: Flags [P.], seq 9633632:9633788, ack 5113, win 313, length 156
18:40:20.288646 IP 159.203.13.65.22 > 198.96.85.21.50272: Flags [P.], seq 9633788:9633944, ack 5113, win 313, length 156
18:40:20.288772 IP 159.203.13.65.22 > 198.96.85.21.50272: Flags [P.], seq 9633944:9634100, ack 5113, win 313, length 156
18:40:20.288911 IP 159.203.13.65.22 > 198.96.85.21.50272: Flags [P.], seq 9634100:9634256, ack 5113, win 313, length 156
18:40:20.289038 IP 159.203.13.65.22 > 198.96.85.21.50272: Flags [P.], seq 9634256:9634412, ack 5113, win 313, length 156
18:40:20.289154 IP 159.203.13.65.22 > 198.96.85.21.50272: Flags [P.], seq 9634412:9634568, ack 5113, win 313, length 156
18:40:20.289261 IP 159.203.13.65.22 > 198.96.85.21.50272: Flags [P.], seq 9634568:9634724, ack 5113, win 313, length 156
18:40:20.289378 IP 159.203.13.65.22 > 198.96.85.21.50272: Flags [P.], seq 9634724:9634880, ack 5113, win 313, length 156
18:40:20.289488 IP 159.203.13.65.22 > 198.96.85.21.50272: Flags [P.], seq 9634880:9635036, ack 5113, win 313, length 156
18:40:20.289607 IP 159.203.13.65.22 > 198.96.85.21.50272: Flags [P.], seq 9635036:9635192, ack 5113, win 313, length 156
18:40:20.289740 IP 159.203.13.65.22 > 198.96.85.21.50272: Flags [P.], seq 9635192:9635348, ack 5113, win 313, length 156
18:40:20.289853 IP 159.203.13.65.22 > 198.96.85.21.50272: Flags [P.], seq 9635348:9635504, ack 5113, win 313, length 156
18:40:20.289977 IP 159.203.13.65.22 > 198.96.85.21.50272: Flags [P.], seq 9635504:9635660, ack 5113, win 313, length 156
18:40:20.290089 IP 159.203.13.65.22 > 198.96.85.21.50272: Flags [P.], seq 9635660:9635816, ack 5113, win 313, length 156
18:40:20.290202 IP 159.203.13.65.22 > 198.96.85.21.50272: Flags [P.], seq 9635816:9635972, ack 5113, win 313, length 156
18:40:20.290352 IP 159.203.13.65.22 > 198.96.85.21.50272: Flags [P.], seq 9635972:9636128, ack 5113, win 313, length 156
18:40:20.290477 IP 159.203.13.65.22 > 198.96.85.21.50272: Flags [P.], seq 9636128:9636284, ack 5113, win 313, length 156
18:40:20.290560 IP 159.203.13.65.22 > 198.96.85.21.50272: Flags [P.], seq 9636284:9636440, ack 5113, win 313, length 156
18:40:20.290670 IP 159.203.13.65.22 > 198.96.85.21.50272: Flags [P.], seq 9636440:9636596, ack 5113, win 313, length 156
18:40:20.290778 IP 159.203.13.65.22 > 198.96.85.21.50272: Flags [P.], seq 9636596:9636752, ack 5113, win 313, length 156
18:40:20.290888 IP 159.203.13.65.22 > 198.96.85.21.50272: Flags [P.], seq 9636752:9636908, ack 5113, win 313, length 156
18:40:20.290998 IP 159.203.13.65.22 > 198.96.85.21.50272: Flags [P.], seq 9636908:9637064, ack 5113, win 313, length 156
18:40:20.291109 IP 159.203.13.65.22 > 198.96.85.21.50272: Flags [P.], seq 9637064:9637220, ack 5113, win 313, length 156
18:40:20.291239 IP 159.203.13.65.22 > 198.96.85.21.50272: Flags [P.], seq 9637220:9637376, ack 5113, win 313, length 156
18:40:20.291337 IP 159.203.13.65.22 > 198.96.85.21.50272: Flags [P.], seq 9637376:9637532, ack 5113, win 313, length 156
18:40:20.291487 IP 159.203.13.65.22 > 198.96.85.21.50272: Flags [P.], seq 9637532:9637688, ack 5113, win 313, length 156
18:40:20.291601 IP 159.203.13.65.22 > 198.96.85.21.50272: Flags [P.], seq 9637688:9637844, ack 5113, win 313, length 156
18:40:20.291712 IP 159.203.13.65.22 > 198.96.85.21.50272: Flags [P.], seq 9637844:9638000, ack 5113, win 313, length 156
18:40:20.292006 IP 198.96.85.21.50272 > 159.203.13.65.22: Flags [.], ack 9633788, win 54, length 0
18:40:20.292043 IP 159.203.13.65.22 > 198.96.85.21.50272: Flags [P.], seq 9638000:9638156, ack 5113, win 313, length 156
18:40:20.292188 IP 159.203.13.65.22 > 198.96.85.21.50272: Flags [P.], seq 9638156:9638416, ack 5113, win 313, length 260
18:40:20.292333 IP 159.203.13.65.22 > 198.96.85.21.50272: Flags [P.], seq 9638416:9638572, ack 5113, win 313, length 156
18:40:20.292435 IP 159.203.13.65.22 > 198.96.85.21.50272: Flags [P.], seq 9638572:9638728, ack 5113, win 313, length 156
18:40:20.292534 IP 159.203.13.65.22 > 198.96.85.21.50272: Flags [P.], seq 9638728:9638884, ack 5113, win 313, length 156
18:40:20.294536 IP 198.96.85.21.50272 > 159.203.13.65.22: Flags [.], ack 9635036, win 49, length 0
18:40:20.294573 IP 159.203.13.65.22 > 198.96.85.21.50272: Flags [P.], seq 9638884:9639040, ack 5113, win 313, length 156
18:40:20.294613 IP 198.96.85.21.50272 > 159.203.13.65.22: Flags [.], ack 9635972, win 45, length 0
18:40:20.294765 IP 159.203.13.65.22 > 198.96.85.21.50272: Flags [P.], seq 9639040:9639396, ack 5113, win 313, length 356
18:40:20.294871 IP 159.203.13.65.22 > 198.96.85.21.50272: Flags [P.], seq 9639396:9639552, ack 5113, win 313, length 156
18:40:20.294969 IP 159.203.13.65.22 > 198.96.85.21.50272: Flags [P.], seq 9639552:9639708, ack 5113, win 313, length 156
18:40:20.295062 IP 159.203.13.65.22 > 198.96.85.21.50272: Flags [P.], seq 9639708:9639864, ack 5113, win 313, length 156
18:40:20.295174 IP 159.203.13.65.22 > 198.96.85.21.50272: Flags [P.], seq 9639864:9640020, ack 5113, win 313, length 156
18:40:20.295265 IP 159.203.13.65.22 > 198.96.85.21.50272: Flags [P.], seq 9640020:9640176, ack 5113, win 313, length 156
18:40:20.295356 IP 159.203.13.65.22 > 198.96.85.21.50272: Flags [P.], seq 9640176:9640332, ack 5113, win 313, length 156
18:40:20.295469 IP 159.203.13.65.22 > 198.96.85.21.50272: Flags [P.], seq 9640332:9640488, ack 5113, win 313, length 156
18:40:20.295561 IP 159.203.13.65.22 > 198.96.85.21.50272: Flags [P.], seq 9640488:9640644, ack 5113, win 313, length 156
18:40:20.295655 IP 159.203.13.65.22 > 198.96.85.21.50272: Flags [P.], seq 9640644:9640800, ack 5113, win 313, length 156
18:40:20.295751 IP 159.203.13.65.22 > 198.96.85.21.50272: Flags [P.], seq 9640800:9640956, ack 5113, win 313, length 156
18:40:20.295842 IP 159.203.13.65.22 > 198.96.85.21.50272: Flags [P.], seq 9640956:9641112, ack 5113, win 313, length 156
18:40:20.295937 IP 159.203.13.65.22 > 198.96.85.21.50272: Flags [P.], seq 9641112:9641268, ack 5113, win 313, length 156
18:40:20.297472 IP 198.96.85.21.50272 > 159.203.13.65.22: Flags [.], ack 9637688, win 39, length 0
18:40:20.297510 IP 159.203.13.65.22 > 198.96.85.21.50272: Flags [P.], seq 9641268:9641424, ack 5113, win 313, length 156
18:40:20.297665 IP 159.203.13.65.22 > 198.96.85.21.50272: Flags [P.], seq 9641424:9641684, ack 5113, win 313, length 260
18:40:20.297770 IP 159.203.13.65.22 > 198.96.85.21.50272: Flags [P.], seq 9641684:9641840, ack 5113, win 313, length 156
18:40:20.297867 IP 159.203.13.65.22 > 198.96.85.21.50272: Flags [P.], seq 9641840:9641996, ack 5113, win 313, length 156
18:40:20.297962 IP 159.203.13.65.22 > 198.96.85.21.50272: Flags [P.], seq 9641996:9642152, ack 5113, win 313, length 156
18:40:20.298049 IP 159.203.13.65.22 > 198.96.85.21.50272: Flags [P.], seq 9642152:9642308, ack 5113, win 313, length 156
18:40:20.298144 IP 159.203.13.65.22 > 198.96.85.21.50272: Flags [P.], seq 9642308:9642464, ack 5113, win 313, length 156
18:40:20.298225 IP 159.203.13.65.22 > 198.96.85.21.50272: Flags [P.], seq 9642464:9642620, ack 5113, win 313, length 156
18:40:20.298313 IP 159.203.13.65.22 > 198.96.85.21.50272: Flags [P.], seq 9642620:9642776, ack 5113, win 313, length 156
18:40:20.298453 IP 159.203.13.65.22 > 198.96.85.21.50272: Flags [P.], seq 9642776:9642932, ack 5113, win 313, length 156
18:40:20.298581 IP 159.203.13.65.22 > 198.96.85.21.50272: Flags [P.], seq 9642932:9643088, ack 5113, win 313, length 156
18:40:20.299441 IP 198.96.85.21.50272 > 159.203.13.65.22: Flags [.], ack 9638884, win 34, length 0
18:40:20.299481 IP 159.203.13.65.22 > 198.96.85.21.50272: Flags [P.], seq 9643088:9643244, ack 5113, win 313, length 156
18:40:20.299636 IP 159.203.13.65.22 > 198.96.85.21.50272: Flags [P.], seq 9643244:9643504, ack 5113, win 313, length 260
18:40:20.299753 IP 159.203.13.65.22 > 198.96.85.21.50272: Flags [P.], seq 9643504:9643660, ack 5113, win 313, length 156
18:40:20.299864 IP 159.203.13.65.22 > 198.96.85.21.50272: Flags [P.], seq 9643660:9643816, ack 5113, win 313, length 156
18:40:20.299976 IP 159.203.13.65.22 > 198.96.85.21.50272: Flags [P.], seq 9643816:9643972, ack 5113, win 313, length 156
18:40:20.300099 IP 159.203.13.65.22 > 198.96.85.21.50272: Flags [P.], seq 9643972:9644128, ack 5113, win 313, length 156
18:40:20.300207 IP 159.203.13.65.22 > 198.96.85.21.50272: Flags [P.], seq 9644128:9644284, ack 5113, win 313, length 156
18:40:20.300350 IP 159.203.13.65.22 > 198.96.85.21.50272: Flags [P.], seq 9644284:9644440, ack 5113, win 313, length 156
18:40:20.301804 IP 198.96.85.21.50272 > 159.203.13.65.22: Flags [.], ack 9641840, win 22, length 0
18:40:20.301856 IP 159.203.13.65.22 > 198.96.85.21.50272: Flags [P.], seq 9644440:9644596, ack 5113, win 313, length 156
18:40:20.302028 IP 159.203.13.65.22 > 198.96.85.21.50272: Flags [P.], seq 9644596:9644856, ack 5113, win 313, length 260
18:40:20.302155 IP 159.203.13.65.22 > 198.96.85.21.50272: Flags [P.], seq 9644856:9645012, ack 5113, win 313, length 156
18:40:20.302269 IP 159.203.13.65.22 > 198.96.85.21.50272: Flags [P.], seq 9645012:9645168, ack 5113, win 313, length 156
18:40:20.302375 IP 198.96.85.21.50272 > 159.203.13.65.22: Flags [.], ack 9643972, win 14, length 0
18:40:20.302405 IP 198.96.85.21.50272 > 159.203.13.65.22: Flags [.], ack 9644440, win 12, length 0
18:40:20.302522 IP 159.203.13.65.22 > 198.96.85.21.50272: Flags [P.], seq 9645168:9645524, ack 5113, win 313, length 356
18:40:20.302627 IP 159.203.13.65.22 > 198.96.85.21.50272: Flags [P.], seq 9645524:9645680, ack 5113, win 313, length 156
18:40:20.302725 IP 159.203.13.65.22 > 198.96.85.21.50272: Flags [P.], seq 9645680:9645836, ack 5113, win 313, length 156
18:40:20.302837 IP 159.203.13.65.22 > 198.96.85.21.50272: Flags [P.], seq 9645836:9645992, ack 5113, win 313, length 156
18:40:20.302951 IP 159.203.13.65.22 > 198.96.85.21.50272: Flags [P.], seq 9645992:9646148, ack 5113, win 313, length 156
18:40:20.303047 IP 159.203.13.65.22 > 198.96.85.21.50272: Flags [P.], seq 9646148:9646304, ack 5113, win 313, length 156
18:40:20.303138 IP 159.203.13.65.22 > 198.96.85.21.50272: Flags [P.], seq 9646304:9646460, ack 5113, win 313, length 156
18:40:20.303237 IP 159.203.13.65.22 > 198.96.85.21.50272: Flags [P.], seq 9646460:9646616, ack 5113, win 313, length 156
18:40:20.303339 IP 159.203.13.65.22 > 198.96.85.21.50272: Flags [P.], seq 9646616:9646772, ack 5113, win 313, length 156
18:40:20.303432 IP 159.203.13.65.22 > 198.96.85.21.50272: Flags [P.], seq 9646772:9646928, ack 5113, win 313, length 156
18:40:20.303527 IP 159.203.13.65.22 > 198.96.85.21.50272: Flags [P.], seq 9646928:9647084, ack 5113, win 313, length 156
18:40:20.303619 IP 159.203.13.65.22 > 198.96.85.21.50272: Flags [P.], seq 9647084:9647240, ack 5113, win 313, length 156
18:40:20.303727 IP 159.203.13.65.22 > 198.96.85.21.50272: Flags [P.], seq 9647240:9647396, ack 5113, win 313, length 156
18:40:20.306910 IP 198.96.85.21.50272 > 159.203.13.65.22: Flags [P.], seq 5113:5185, ack 9644440, win 12, length 72
18:40:20.306990 IP 198.96.85.21.50272 > 159.203.13.65.22: Flags [.], ack 9645012, win 10, length 0
18:40:20.307018 IP 159.203.13.65.22 > 198.96.85.21.50272: Flags [P.], seq 9647396:9647552, ack 5185, win 313, length 156

63282 packets captured
63364 packets received by filter
82 packets dropped by kernel