root@comp3134FirstDroplet:~# tcpdump -c 5 -i eth0
tcpdump: verbose output suppressed, use -v or -vv for full protocol decode
listening on eth0, link-type EN10MB (Ethernet), capture size 262144 bytes
18:32:58.616583 IP comp3134FirstDroplet.ssh > 198.96.85.21.50272: Flags [P.], seq 3952234031:3952234139, ack 4238154878, win 313, length 108
18:32:58.616657 IP comp3134FirstDroplet.ssh > 198.96.85.21.50272: Flags [P.], seq 108:144, ack 1, win 313, length 36
18:32:58.616727 IP comp3134FirstDroplet.ssh > 198.96.85.21.50272: Flags [P.], seq 144:252, ack 1, win 313, length 108
18:32:58.616783 IP comp3134FirstDroplet.ssh > 198.96.85.21.50272: Flags [P.], seq 252:288, ack 1, win 313, length 36
18:32:58.618286 IP comp3134FirstDroplet.ssh > 198.96.85.21.50272: Flags [P.], seq 288:468, ack 1, win 313, length 180
5 packets captured
10 packets received by filter
0 packets dropped by kernel